title_id,title,date_added,release_year,rating,duration,description
81041414,Sparta,02/01/2019,2018,TV-MA,1,"While investigating the mysterious death of a teacher, a grizzled detective gets caught up in the world of a high-stakes virtual reality game."
80990612,Sword Art Online Alternative: Gun Gale Online,02/01/2019,2018,TV-14,1,College student Karen takes up Gun Gale Online and gets a reputation as the Pink Demon. Then her gaming buddy Pitohui asks her to join the Squad Jam.
81059684,The Bible's Buried Secrets,02/01/2019,2011,TV-14,1,"Host Francesca Stavrakopoulou travels across the Middle East, offering extraordinary insights into the stories of the Old Testament."
81059816,The Big Catch,02/01/2019,2015,TV-PG,1,"In a global competition, eight fishing enthusiasts battle extreme conditions and dangerous waters to be crowned the ultimate angler."
81063049,The Bomb Squad,02/01/2019,2011,TV-MA,1,This documentary follows British bomb disposal teams in Afghanistan and the dangers they face in their methodical lives on the front lines of war.
80992963,The Story of Us with Morgan Freeman,02/01/2019,2017,TV-14,1,"Explore the forces of love, belief, power, war, peace, rebellion and freedom in this series about the ties that bind – and destroy – humanity."
81059856,World's Busiest Cities,02/01/2019,2017,TV-PG,1,"From Moscow to Mexico City, three BBC journalists delve into the inner workings of some of the most burgeoning metropolises on Earth."
80078037,Little Lunch,02/01/2018,2015,,1,"Adopting a child's perspective, this show takes a humorous look at what happens during those action-packed 15 minutes of snack time each day."
80234290,Revolting Rhymes,02/01/2018,2017,TV-PG,1,Popular fairy tales take on a darkly comic edge in these short animated films based on a book by Roald Dahl and illustrator Quentin Blake.
80063658,The Code,02/01/2018,2011,TV-PG,1,"In this three-part documentary series, host Marcus du Sautoy examines the mathematical code underlying all of life on Earth and the universe itself."
80005332,Camelia la Texana,02/01/2017,2014,TV-14,1,"Inspired by the famous song ""Contrabando y Traición,"" Camelia, a beautiful girl from San Antonio, kills her lover and becomes a legendary drug runner."
80157242,Mexico Diseña,02/01/2017,2016,TV-PG,1,Young fashion designers vie for the chance to become Mexico's next big talent by competing before judges in grueling tests of creativity and stamina.
80161851,Pioneers of African-American Cinema,02/01/2017,1946,TV-14,1,This newly preserved collection features more than 20 films made by groundbreaking African American directors for black audiences from 1915 to 1946.
80093829,Masha's Tales,02/01/2016,2012,TV-Y,1,"Fairy tales get a funny twist when Masha retells them, because she tends to get the details just a little jumbled up in this animated kids' series."
80042371,The Lizzie Borden Chronicles,02/01/2016,2015,TV-14,1,"Exonerated in the murder of her father and stepmother, Lizzie Borden takes on crime lords, detectives and other foes as she savors her new infamy."
80065491,Captive,12/09/2016,2016,TV-MA,1,"This documentary series reconstructs history's most complex, high-stakes hostage negotiations as kidnapping victims recount their terrifying ordeals."
80149141,Four Seasons in Havana,12/09/2016,2016,TV-MA,1,"As Havana slowly revolves through the year, wistful detective Mario Conde probes the sultry heart of the city to investigate dark and deadly crimes."
80091245,White Rabbit Project,12/09/2016,2016,TV-PG,1,"Kari Byron, Tory Belleci and Grant Imahara rank history's greatest inventions, heists and more in this series from the producers of ""MythBusters."""
80158044,Miss in Kiss,12/08/2016,2016,TV-14,1,"A quirk of fate sends an ordinary, sweet-natured high school girl and her father into the home of the school genius, on whom she has a huge crush."
80109535,The Cuba Libre Story,12/08/2016,2015,TV-14,1,"This documentary series recounts the tumultuous history of Cuba, a nation of foreign conquest, freedom fighters and Cold War political machinations."
80189522,Dogs of Berlin,12/07/2018,2018,TV-MA,1,"Two cops investigate the murder of a famous Turkish-German soccer player, but one of them has underworld connections that mire the case in controversy."
80195198,Pine Gap,12/07/2018,2018,TV-MA,1,"At top-secret U.S.-Australian joint defense facility Pine Gap, fissures appear in the critical alliance as spies work with, and against, each other."
81087498,Astronomy Club: The Sketch Show,12/06/2019,2019,TV-MA,1,"With unique individual perspectives that converge into a unified voice, sketch comedy group Astronomy Club delivers a smart and absurd brand of humor."
81075536,Glow Up,12/06/2019,2019,TV-14,1,"In this competition show, aspiring makeup artists navigate colorful challenges to win a career-making opportunity in the beauty industry."
80228274,Teasing Master Takagi-san,12/06/2019,2019,TV-PG,1,"Teased constantly by classmate Takagi-san, middle-schooler Nishikata swears payback by trying (and failing) to give her a dose of her own medicine."
80213588,The Confession Killer,12/06/2019,2019,TV-14,1,Henry Lee Lucas rose to infamy when he confessed to hundreds of unsolved murders. This docuseries examines the truth – and horrifying consequences.
80987516,Three Days of Christmas,12/06/2019,2019,TV-MA,1,"Four sisters deal with family drama and secrets throughout three different time periods, all occurring on Christmas Day."
81019391,Triad Princess,12/06/2019,2019,TV-MA,1,"After jostling her way into a gig as a celebrity bodyguard, the boisterous daughter of a powerful triad boss shakes up a TV star's life and finds love."
80240027,Virgin River,12/06/2019,2019,TV-14,1,"Searching for a fresh start, a nurse practitioner moves from LA to a remote northern California town and is surprised by what – and who – she finds."
80177346,Happy!,12/06/2018,2017,TV-MA,1,A boozy ex-cop turned hit man thinks he's losing his marbles when a cartoon unicorn only he can see urges him to rescue a girl kidnapped by Santa.
81083590,Home for Christmas,12/05/2019,2019,TV-MA,1,"Tired of the constant comments on her relationship status, perpetually single Johanne starts a 24-day hunt for a boyfriend to bring home for Christmas."
80236118,V Wars,12/05/2019,2019,TV-MA,1,A fast-spreading disease that turns victims into blood-sucking fiends pits two best friends against each other in a fight for humanity's future.
80211229,Cleo & Cuquin,12/05/2018,2018,TV-Y,1,Spirited sister-brother duo Cleo and Cuquín try on different professions each day to help their other siblings solve problems and enjoy new adventures.
80204730,The Last O.G.,12/05/2018,2018,TV-MA,1,"After 15 years behind bars, a kindhearted ex-drug dealer returns to Brooklyn looking for a fresh start, only to discover things have changed. A lot."
81135440,The Prince of Tennis ~ Match! Tennis Juniors ~,12/04/2019,2019,TV-PG,1,A tennis whiz beats the odds to excel on the court while juggling school and inspiring teammates. Based on the hit manga series by Takeshi Konomi.
81055408,The Road to Love,12/04/2019,2019,TV-14,1,"After an argument with her dad, a young woman from a family of macho truck drivers is kicked out of the home and must make her own success as a trucker."
81219073,ARASHI's Diary -Voyage-,12/31/2019,2019,TV-PG,1,"Twenty years after their debut, join the beloved members of Arashi on a new journey as they showcase their lives, talents and gifts to the world."
81224811,Pucca: Love Recipe,12/31/2019,2018,TV-Y7,1,"Faced with a threat to the survival of her family restaurant, as well as a rival for Garu's heart, Pucca fights for all that she loves."
81224839,Rainbow Ruby,12/31/2019,2016,TV-Y,1,"Ruby makes magical journeys with her teddy bear Choco to Rainbow Village, where her toys come to life – and where there's always a problem to solve!"
80990609,The Neighbor,12/31/2019,2019,TV-MA,1,Self-centered Javier's life gets a bit messy when he unexpectedly becomes a superhero – and his recent ex is tasked with uncovering his identity.
81203251,Yanxi Palace: Princess Adventures,12/31/2019,2019,TV-14,1,A determined Qing dynasty princess contends with palace intrigue and a vendetta against her family while navigating the treacherous terrain of romance.
81020868,Conan Without Borders,12/31/2018,2018,TV-14,1,Late-night talk show host Conan O'Brien hits the road in this special that brings him and his sense of humor to far-flung destinations.
81029634,For the Win,12/31/2018,2017,TV-14,1,Frisbee national champion Brodie Smith challenges inventive athletes across the US to an exhibition match in the unconventional sports they've created.
81032812,Inst@famous,12/31/2018,2018,TV-MA,1,Self-made social media celebrities share the stories of how they built their online empires and where they plan to take their unexpected fame next.
81029647,Slobby's World,12/31/2018,2018,TV-MA,1,Welcome to the irreverent world of Robert Hall – aka Slobby Robby – a pop culture junkie who buys and sells collectable goods from the '80s and '90s.
80198350,Bat Pat,12/31/2017,2016,TV-Y,1,"A curious and talkative bat finds spooky fun on the streets of Fogville, a town that's not as quiet as it seems, with a plucky girl and her brothers."
80230402,Dave Chappelle: Equanimity & The Bird Revelation,12/31/2017,2017,TV-MA,1,"Comedy titan Dave Chappelle caps a wild year with two stand-up specials packed with scorching new material, self-reflection and tough love."
70205634,El Chavo,12/31/2017,1979,TV-PG,1,"El Chavo is a poor, nameless orphan who lives in an apartment building with La Chilindrina, Quico, Doña Florinda, Don Ramón and Professor Jirafales."
80221778,Geronimo Stilton,12/31/2017,2011,TV-Y,1,"With the help of brainy and adventurous sidekicks, New Mouse City's favorite journalist investigates mysteries that take him around the world,"
80029102,Lo que la vida me robó,12/31/2017,2013,TV-14,1,"In seaside Aguazul, beautiful Montserrat and her wily mother tangle with lovers, gangsters, financial ruin, obsession – and murder."
70205710,Rebelde,12/31/2017,2004,TV-14,1,"Six students at an exclusive prep school, some on scholarship, discover that music can close the class divide."
70205714,Rubi,12/31/2017,2004,TV-PG,1,"Ruby, jealous of her wealthy best friend Maribel, cooks up a scheme to marry a millionaire. Hector, Maribel's boyfriend, is her target."
70236010,Teresa,12/31/2017,2010,TV-PG,1,"We all want so much more than we have, but how far are we willing to go to get it?"
80024132,Battle Creek,12/31/2015,2015,TV-14,1,"A polished FBI agent must team up with a cynical cop when he's dispatched to Battle Creek, Michigan, to set up an office at the local precinct."
81054849,The Disastrous Life of Saiki K.: Reawakened,12/30/2019,2019,TV-14,1,"Kusuo and his gaggle of self-proclaimed friends are back for more psychic mishaps. If he didn't have enough problems before, he's got even more now."
81030762,Pioneers: First Women Filmmakers*,12/30/2018,1925,TV-PG,1,"This collection restores films from women who tackled hot-button issues, transcended norms, and left a mark on the history of cinema and the industry."
80154689,My Runway,12/30/2016,2016,TV-14,1,An egotistic top male model and a pretty model wannabe are forced to live each other's lives until they figure out a way to undo their body switch.
80990571,Blue Planet II,12/03/2018,2017,TV-G,1,"This sequel to the award-winning nature series ""Blue Planet"" dives beneath Earth's oceans to reveal the dazzling vistas and amazing creatures there."
81036061,In Family We Trust,12/29/2018,2018,TV-MA,1,"When the head of the lucrative family business passes away, his will leaves the clan at extreme odds."
80208337,La Mante,12/29/2017,2017,TV-MA,1,"Decades after her capture, a serial killer offers to help solve a string of copycat murders – but only if her son, now a cop, will work by her side."
80192950,The Real Football Factories,12/29/2017,2006,TV-MA,1,Examine the troubling history of football hooliganism and hear from real hooligans about their bitter rivalries and rowdiest brawls.
80163430,Wadi,12/29/2017,2015,TV-14,1,"After the death of his father, a passive and good-natured teenager named Wadi struggles with family, work and love."
80240277,Hashoter Hatov,12/28/2018,2015,TV-MA,1,An honest – though overzealous – police officer strives to do good work while dealing with his bickering parents and incompetent coworkers.
80217475,Murder Mountain,12/28/2018,2018,TV-MA,1,"In Humboldt County, California, the big business of legal marijuana brings in visitors from around the world. Some are never seen again."
80194558,Selection Day,12/28/2018,2018,TV-14,1,Two teen cricket prodigies struggle against their overbearing father and a system stacked against them to realize their own ambitions and identities.
81010817,Kevin Hart: Don’t F**k This Up,12/27/2019,2019,TV-MA,1,"Amid turmoil in his career and marriage, comedian and film star Kevin Hart opens up about his personal breakthroughs as he navigates crises and fame."
81037848,The Gift,12/27/2019,2019,TV-MA,1,A painter in Istanbul embarks on a personal journey as she unearths universal secrets about an Anatolian archaeological site and its link to her past.
80204885,Towies,12/27/2017,2016,TV-MA,1,Australia's toughest tow truck operators work to keep Queensland's streets clear of overturned semis and other automotive disasters.
80116839,Chasing Cameron,12/27/2016,2016,TV-14,1,Go behind the scenes with social media sensation Cameron Dallas as he takes his career to the next level on an international tour.
80225085,Fast & Furious Spy Racers,12/26/2019,2019,TV-Y7-FV,1,A government agency recruits teen driver Tony Toretto and his thrill-seeking friends to infiltrate a criminal street racing circuit as undercover spies.
80213020,The Bonfire of Destiny,12/26/2019,2019,TV-MA,1,"After a devastating fire in 1897 Paris, three women find their lives upended by betrayals, deceptions and romantic turmoil. Inspired by real events."
80211991,You,12/26/2018,2018,TV-MA,1,"Obsessed with an aspiring writer, a charming bookstore manager goes to extreme measures to insert himself into her life."
80037129,Ezel,12/26/2016,2009,TV-14,1,A young man framed for a crime escapes a prison sentence by faking his own death and assuming a new identity as he seeks revenge.
80037176,Kaçak,12/26/2016,2013,TV-14,1,A cop who killed a mobster's son and fled to a small town with a changed identity finds his quiet new life disrupted when he becomes a local hero.
80037484,Kurt Seyit & Sura,12/26/2016,2014,TV-14,1,A Turkish lieutenant and the daughter of Russian nobles fight for their love against forces of family and social expectation and historical events.
80120301,Mahmut & Meryem,12/26/2016,2013,TV-14,1,"In the 16th century, the heir to a Muslim empire embarks on a dangerous journey to find his true love, who was taken away by her Christian father."
80225526,Part-Time Idol,12/25/2017,2017,TV-14,1,"After taking a break from the business, a music producer returns with a new project in mind: launching a co-ed pop idol group."
80195377,Planet Earth II,12/25/2017,2016,TV-G,1,"In this sequel to the Emmy-winning ""Planet Earth"" series, viewers are treated to rich and intimate views of the natural diversity of our planet."
80042177,Sammy & Co,12/25/2015,2014,TV-G,1,"In an underwater village bordering a tropical island, two young turtles and their pals keep their home safe and enjoy adventures in the big, wild sea."
80997338,Hi Score Girl,12/24/2018,2018,TV-PG,1,"A chronic gamer abysmally inept in academics and sports finally meets his match at his usual shady arcade – and it’s his rich classmate, Akira."
80210736,Stand Up and Away! with Brian Regan,12/24/2018,2018,TV-14,1,Brian Regan blends his trademark observational stand-up with short sketches and a bit of audience interaction in this hybrid comedy series.
81020728,Way Back into Love,12/24/2018,2011,TV-PG,1,"After years in the U.S., a Taiwanese immigrant returns to her hometown with a young daughter in tow to assist her father with his bed-and-breakfast."
80153226,Ninja Hattori,12/23/2018,1981,TV-Y7,1,"Elementary school student Kenichi Mitsuba's household gains a surprising new member: Kanzo Hattori, a mischievous but helpful young ninja."
80107989,Watership Down,12/23/2018,2018,TV-PG,1,A warren of rabbits battles many threats on their daring journey to find a new home in this adaptation of the classic novel by Richard Adams.
80158649,Myths & Monsters,12/23/2017,2017,TV-14,1,This documentary series takes us to the mythic landscapes of Europe to explore some of most enduring legends produced by European culture.
81039096,Demon's Path,12/22/2018,2018,TV-MA,1,"To catch three criminal masterminds, a group of cops teams up with a forensic pathologist who can see a murder victim's final moments before death."
81032874,Single Ladies Senior,12/22/2018,2018,TV-14,1,Four best friends and spirited career women navigate the treacherous world of romance – even as it stands in the way of work and friendship.
80165247,72 Dangerous Animals: Latin America,12/22/2017,2017,TV-14,1,"Powerful cats, indestructible arachnids and flesh-melting pit vipers are just the beginning in this series about Latin America's deadliest creatures."
80207124,7 Days Out,12/21/2018,2018,TV-PG,1,"Witness the excitement and drama behind the scenes in the seven days leading up to major live events in the worlds of sports, fashion, space and food."
80172145,Diablero,12/21/2018,2018,TV-MA,1,"When a young girl goes missing in a big city, a desperate priest joins a demon hunter and his motley crew on an otherworldly mission to find her."
81032872,Jojo's World,12/21/2018,2017,TV-14,1,"Diagnosed with a condition that could make her infertile, a career woman must choose one of four bachelors to make a baby with before time runs out."
81032873,Lion Pride,12/21/2018,2017,TV-14,1,"After crossing paths at a crime scene, a renowned math teacher and an antiques appraiser embark on an unexpected journey of love and self-discovery."
81032867,Love @ Seventeen,12/21/2018,2016,TV-14,1,"Radically changed by a misunderstanding 13 years ago, a biotech expert runs into an old flame and suffers an illness that takes her back to the past."
80200596,Perfume,12/21/2018,2018,TV-MA,1,"When a singer is found murdered, with her scent glands excised from her body, detectives probe a group of friends who attended boarding school with her."
80997339,Sirius the Jaeger,12/21/2018,2018,TV-MA,1,"In imperial Tokyo, a group calling themselves ""Jaegers"" secretly hunt the vampires seeking the Ark of Sirius. Among them is young werewolf, Yuliy."
81007175,Wolf,12/21/2018,2018,TV-MA,1,"Tasked with risky missions across Turkey, members of a special-operations police unit confront danger and tragedy both on the field and at home."
81157169,Agent,12/20/2019,2019,TV-MA,1,"A former footballer tries to make it as a player agent in the world of African soccer, but a secret from his past threatens to destroy everything."
80189685,The Witcher,12/20/2019,2019,TV-MA,1,"Geralt of Rivia, a mutated monster-hunter for hire, journeys toward his destiny in a turbulent world where people often prove more wicked than beasts."
80040119,Durarara!!,12/20/2018,2016,TV-14,1,"A young man looking for excitement moves to Ikebukuro, a district in Tokyo, where he finds a world of mystery in which the past and present mesh."
70221084,Dance Academy,12/20/2017,2013,TV-PG,1,Fifteen-year-old Tara Webster's dream of dancing comes true when she gets into a top dance academy. She soon realizes dancing is only half the battle.
80202133,Nightflyers,12/02/2019,2018,TV-MA,1,"With humankind's future at stake, a group of scientists and a powerful telepath venture into the void aboard a spaceship full of secrets."
81004280,Memories of the Alhambra,12/02/2018,2018,TV-14,1,"While looking for the cryptic creator of an innovative augmented-reality game, an investment firm executive meets a woman who runs a hostel in Spain."
80106265,Pacific Heat,12/02/2016,2016,TV-14,1,"In this animated satire, a covert squad of operatives short on smarts but long on confidence tackles crime on the glitzy Gold Coast of Australia."
80081754,Power Rangers Dino Charge,12/02/2015,2015,TV-Y7,1,"In the time of dinosaurs, the ancient and powerful Energems were lost on Earth, and now the evil bounty hunter Sledge has returned to find them."
80989919,Twice Upon A Time,12/19/2019,2019,TV-MA,1,"Months after a crushing breakup, a man receives a mysterious package that opens a portal to the past – and gives him a chance to win back his ex."
80190279,The Indian Detective,12/19/2017,2017,TV-14,1,"In this crime dramedy, a suspended Canadian cop visits his father in Mumbai and assists in investigating a huge criminal operation with links to home."
81031373,Don't F**k with Cats: Hunting an Internet Killer,12/18/2019,2019,TV-MA,1,A twisted criminal's gruesome videos drive a group of amateur online sleuths to launch a risky manhunt that pulls them into a dark underworld.
80241410,Soundtrack,12/18/2019,2019,TV-MA,1,"Love, loss and transformative luck intersect in this musical drama about two struggling artists experiencing life at full volume in Los Angeles."
80166467,Ellen DeGeneres: Relatable,12/18/2018,2018,TV-14,1,"In her first special since 2003, Ellen revisits her road to stardom and details the heartfelt – and hilarious – lessons she's learned along the way."
81026363,Ashes of Love,12/16/2018,2018,TV-PG,1,"Hidden away by her mother, the Floral Goddess, the naïve Jinmi is drawn to Xufeng, the Heavenly Emperor's son. Yet forces conspire against them."
70221348,DreamWorks Holiday Classics,12/16/2018,2011,TV-PG,1,"Join your DreamWorks friends for these four holiday specials, featuring Shrek and Donkey, Hiccup and Toothless, and the wacky animals from Madagascar."
70264416,Stoked,12/16/2017,2010,TV-PG,1,Six teenage groms come together one summer to share a dream: to work at the world-renowned Surfer's Paradise Resort on the legendary Sunset Island.
80117627,Call Me Francis,12/16/2016,2016,TV-14,1,"On his path to becoming Pope Francis, Father Jorge Bergoglio pursues his religious vocation in a country ravaged by a brutal military dictatorship."
80104983,Crazyhead,12/16/2016,2016,TV-MA,1,Bowling alley worker Amy and nonconformist Raquel kick some serious demon butt while also facing their inner demons as they navigate their early 20s.
80188605,Cinderella and the Four Knights,12/15/2019,2016,TV-14,1,"Catching the eye of a wealthy gentleman, spunky Ha-won gets hired to live with his three immature grandsons so she can whip them into shape."
81159258,Crash Landing on You,12/15/2019,2019,TV-14,1,"A paragliding mishap drops a South Korean heiress in North Korea – and into the life of an army officer, who decides he will help her hide."
81213155,"Crazy, Lovely, Cool",12/15/2019,2018,TV-MA,1,"For a group of charismatic undergraduates, the jolting revelations from a campus blog turn surviving university life into a serious matter."
80205232,Girls und Panzer,12/15/2019,2012,TV-14,1,Miho Nishizumi tries to escape her family's tradition of tankery by enrolling at a new high school. Instead she gets back into the sport with friends.
81235603,Sym-Bionic Titan,12/15/2019,2010,TV-PG,1,"Aliens fleeing their planet land on Earth, pose as teenagers and fight off mutant space monsters by joining forces to become a powerful giant robot."
80998331,Anjaan: Rural Myths,12/15/2018,2018,TV-14,1,"Spine-chilling stories of malevolent spirits unfold in villages, jungles and haunted buildings across India."
81026453,Emogenius,12/15/2018,2017,TV-PG,1,"Two pairs of contestants go head-to-head for several rounds, deciphering puzzles and messages comprised of emojis for a chance at a $10,000 prize."
81026475,Idiotest,12/15/2018,2014,TV-PG,1,Comedian Ben Gleib hosts this game show in which teams of two compete to solve increasingly tough brain teasers. Faster answers mean more money.
81026478,Minute to Win It,12/15/2018,2013,TV-PG,1,"In this game show hosted by Olympian Apolo Anton Ohno, contestants compete by completing 60-second challenges using common household items."
80179556,Skin Wars: Fresh Paint,12/15/2018,2016,TV-14,1,"In each episode of this ""Skin Wars"" spinoff hosted by RuPaul, talented artists from various fields compete in body art for the first time."
81026477,Winsanity,12/15/2018,2016,TV-G,1,Actor Donald Faison hosts this game show in which contestants must arrange numerical-based trivia tidbits from largest to smallest for various prizes.
80036412,A.D. Kingdom and Empire,12/15/2017,2015,TV-14,1,"In the wake of Jesus Christ's crucifixion, his apostles dedicate themselves to spreading his message, risking their freedom and their lives."
70213120,Beyblade: Metal Fusion,12/15/2017,2009,TV-Y7,1,"In this anime adventure series for kids, the forces of good and evil ""blade it out,"" battling each other with enchanted spinning tops."
80214013,Black,12/15/2017,2017,TV-MA,1,"A Grim Reaper, a detective and a woman who foresees death get ensnared in matters of life and death – and dark mysteries of twenty years past."
80227028,Cheuk Wan-Chi: Two Night Stand,12/15/2017,2015,TV-MA,1,Writer and stand-up comedian Cheuk Wan-chi cracks wise at the follies of single womanhood and takes on politics in Hong Kong with nuance and flair.
80173711,Erased,12/15/2017,2017,TV-14,1,"After finding his mom killed, Satoru's time-traveling ability takes him back 18 years for a chance to prevent her death and those of three classmates."
80059446,Wormwood,12/15/2017,2017,TV-14,1,"In this genre-bending tale, Errol Morris explores the mysterious death of a U.S. scientist entangled in a secret Cold War program known as MK-Ultra."
80115112,Cannabis,12/15/2016,2016,TV-MA,1,"When a huge marijuana shipment falls prey to thieves, the aftermath touches players from all ranks of the drug trade between Morocco and Europe."
