title_id,title,date_added,release_year,rating,duration,description
80136796,Show Me the Money,09/09/2018,2004,TV-14,2,Four ordinary family members find their lives turned upside down when they become overnight millionaires thanks to an unlikely benefactor.
70270745,Ripper Street,09/08/2017,2017,TV-MA,5,"It's been six months since the last Jack the Ripper killing, and East London is hopeful that his reign of terror might have run its course."
70177067,Haven,09/08/2015,2015,TV-14,5,"Residents of Haven, Maine, are plagued by supernatural afflictions. To reveal the truth, FBI agent Audrey Parker must delve into her own strange past."
80002612,Marvel's Iron Fist,09/07/2018,2018,TV-MA,2,"Danny Rand resurfaces 15 years after being presumed dead. Now, with the power of the Iron Fist, he seeks to reclaim his past and fulfill his destiny."
80095988,Stretch Armstrong & the Flex Fighters,09/07/2018,2018,TV-Y7-FV,2,Jake Armstrong and his best friends are unexpectedly transformed into superheroes who learn to reach far beyond the limits of any ordinary teenager.
80024113,Galavant,09/07/2016,2016,TV-PG,2,"In a time of legend, Galavant the knight embarks on a quest to save his fair lady and become a hero in this tongue-in-cheek musical comedy."
80200942,Elite,09/06/2019,2019,TV-MA,2,"When three working-class teens enroll in an exclusive private school in Spain, the clash between them and the wealthy students leads to murder."
80186848,Jack Whitehall: Travels with My Father,09/06/2019,2019,TV-MA,3,"Jovial comic Jack Whitehall invites his stuffy father, Michael, to travel with him through Southeast Asia in an attempt to strengthen their bond."
70197049,Once Upon a Time,09/06/2018,2018,TV-PG,7,"In this fantasy series, a young woman is drawn to a small Maine town and discovers that it's filled with elements of the fairy tale world."
70283260,Reign,09/05/2017,2017,TV-14,4,"This vivid historical drama series tells of the rise to power of Mary, Queen of Scots, amid a court full of sexual and political intrigue."
70143860,The Vampire Diaries,09/04/2017,2017,TV-14,8,"Trapped in adolescent bodies, feuding vampire brothers Stefan and Damon vie for the affection of captivating teenager Elena."
80020542,Gotham,09/30/2019,2019,TV-14,5,"Long before he was commissioner, rookie cop James Gordon takes on Gotham City crime and corruption to avenge the murder of Bruce Wayne's parents."
80074503,Real Rob,09/29/2017,2017,TV-MA,2,Go inside the world of comedian and actor Rob Schneider in this comedy series that follows the ups and downs of his career and family life.
80217957,Reboot: The Guardian Code,09/28/2018,2018,TV-Y7-FV,2,Four tech-savvy teens hone their skills as cyber-superheroes in a series of secret missions to save the world.
80113201,Skylanders Academy,09/28/2018,2018,TV-Y7,3,Travel the vast Skylander universe in this animated series as a ragtag group of academy graduates build trust and heart in their fight against evil.
80115297,El Marginal,09/27/2019,2019,TV-MA,3,"While investigating a kidnapping, an ex-cop sent to infiltrate a prison finds himself surrounded by dangerous felons who can't know his real identity."
80216752,Explained,09/26/2019,2019,TV-14,2,"This enlightening series from Vox digs into a wide range of topics such as the rise of cryptocurrency, why diets fail, and the wild world of K-pop."
80180182,Norsemen,09/26/2018,2018,TV-MA,2,"The residents of an 8th-century Viking village experience political rivalry, social change and innovations that upend their culture and way of life."
80131479,Terrace House: Aloha State,09/26/2017,2017,TV-14,4,"The beautiful island of Oahu is host to a new batch of six strangers who share a single roof, multiple conflicts and no script in this reality series."
80057883,Abstract: The Art of Design,09/25/2019,2019,TV-14,2,Step inside the minds of the most innovative designers in a variety of disciplines and learn how design impacts every aspect of life.
80108495,Glitch,09/25/2019,2019,TV-MA,3,A police officer and a doctor face an emotionally charged mystery when seven local residents inexplicably return from the dead in peak physical form.
80059465,Locked Up,09/25/2019,2019,TV-MA,4,"Manipulated into embezzling funds for her boyfriend and sentenced to prison, a naïve young woman must quickly learn to survive in a harsh new world."
70185015,Portlandia,09/25/2019,2018,TV-14,8,"Fred Armisen and Carrie Brownstein send up the residents of Portland, Ore. Typical targets include artisanal light bulbs and feminist bookstores."
80023289,Dark Matter,09/25/2017,2017,TV-14,3,"After waking up aboard a derelict spaceship with no memories, the crew of the Raza investigates the mystery of their identities and destination."
70210884,American Horror Story,09/24/2019,2018,TV-MA,8,"This twisted Emmy-winning drama plays upon the power of supernatural fears and everyday horrors, exploring humankind's unsettling capacity for evil."
80127001,Resurrection: Ertugrul,09/24/2019,2018,TV-14,5,"When a good deed unwittingly endangers his clan, a 13th-century Turkish warrior agrees to fight a sultan's enemies in exchange for new tribal land."
80011539,VeggieTales in the House,09/23/2016,2016,TV-Y,4,"Bob the Tomato, Larry the Cucumber and their Veggie pals venture beyond the kitchen counter in these playful adventures with Christian themes."
70197042,Person of Interest,09/22/2016,2016,TV-14,5,Ex-CIA agent John Reese and enigmatic billionaire Mr. Finch use software that can predict future events to prevent violent crimes before they occur.
80095697,Disenchantment,09/20/2019,2019,TV-14,2,"Princess duties call, but she'd rather be drinking. Free-spirited Bean exasperates the king as she wreaks havoc with her demon and elf pals."
80190009,Fastest Car,09/20/2019,2019,TV-MA,2,The drivers of exotic supercars put their street cred on the line against deceptively fast sleeper cars built and modified by true gearheads.
80063740,Quantico,09/02/2018,2018,TV-14,3,"When evidence in a deadly terrorist attack implicates FBI trainee Alex Parrish, she must discover which one of her classmates framed her."
70281312,The Blacklist,09/19/2019,2019,TV-14,6,"After turning himself in, a brilliant fugitive offers to help the FBI bag other baddies, but only if rookie profiler Elizabeth Keen is his partner."
70242079,Beauty & the Beast,09/19/2016,2016,TV-14,4,A homicide detective and a veteran who has been turned into a beast by a military experiment gone awry become allies after they meet by chance.
80136784,The Adjusters,09/18/2017,2010,TV-14,2,"An insurance adjuster investigates cases of possible fraud while hiding a romance with a colleague, unaware that someone he trusts is toying with him."
70295760,Penny Dreadful,09/17/2016,2016,TV-MA,3,"The classic tales of Dracula, Frankenstein, Dorian Gray and more are woven together in this horror series set on the dark streets of Victorian London."
81013148,Mini Wolf,09/16/2018,2014,TV-G,2,Mini-Wolf and his fun-loving pals friends are always on the look out for a new adventure – even if it includes a little bit of mischief.
80119379,Silver Spoon,09/15/2017,2015,TV-14,2,"Forced to become an apprentice cop, cocky playboy Igor finds he's got a knack for police work. But his job soon takes him down a dark personal path."
80119145,VeggieTales in the City,09/15/2017,2017,TV-Y,2,"With exciting trips to the big city, the ski slopes and beyond, the Veggie friends expand their horizons and learn valuable faith-based lessons."
80117545,American Vandal,09/14/2018,2018,TV-MA,2,"A high school is rocked by an act of vandalism, but the top suspect pleads innocence and finds an ally in a filmmaker. A satirical true crime mystery."
80066429,Ingobernable,09/14/2018,2018,TV-MA,2,"The first lady of Mexico is a woman of conviction and ideals. But when she loses faith in her husband, she'll need all her strength to uncover the truth."
80171611,I'm Sorry,09/13/2019,2019,TV-MA,2,"Life is a series of awkward situations for comedy writer and mom Andrea, thanks to plenty of neuroses and a knack for sticking her foot in her mouth."
81028317,The Chef Show,09/13/2019,2019,TV-MA,2,"Writer, director and food enthusiast Jon Favreau and chef Roy Choi explore food in and out of the kitchen with accomplished chefs and celebrity friends."
80077977,The Ranch,09/13/2019,2019,TV-MA,7,"Being a pro athlete didn't pan out for Colt. Now he's helping his dad and brother keep the ranch afloat, and figuring out how he fits into the family."
80166239,Zak Storm,09/13/2018,2016,TV-Y7-FV,3,"Teen surfer Zak Storm is mysteriously transported to the Bermuda Triangle, where he becomes the captain of a magical ship full of misfits."
80118289,Offspring,09/13/2017,2017,TV-MA,7,"A Melbourne obstetrician in her thirties struggles with the increasingly chaotic family, romantic and professional aspects of her life in this drama."
81072571,Tobot,09/11/2019,2018,TV-Y7-FV,2,They’re robots that can transform into cars – and the Tobots are committed to fighting villains to protect the city and root out crime.
70184207,Shameless (U.S.),09/10/2019,2018,TV-MA,9,This dramedy based on a British series centers on siblings in a dysfunctional Chicago family who struggle while coping with their alcoholic father.
70302573,Sword Art Online,09/10/2019,2014,TV-14,2,A video game whiz helps create a new technology that enables players to guide their online avatars with their own bodies – but a dark twist emerges.
70279852,Marvel's Agents of S.H.I.E.L.D.,09/01/2019,2019,TV-PG,6,"Agent Phil Coulson, seen in action in Marvel's The Avengers, assembles a team of top S.H.I.E.L.D. agents to investigate bizarre threats."
80174902,Moving Art,09/01/2019,2018,TV-G,3,"Experience nature's art as filmmaker Louie Schwartzberg highlights the beauty that lurks in oceans, forests, deserts and flowers."
70205012,Naruto,09/01/2019,2008,TV-PG,9,"Guided by the spirit demon within him, orphaned Naruto learns to harness his powers as a ninja in this anime adventure series."
80036427,Nature's Weirdest Events,09/01/2019,2015,TV-PG,3,"Host Chris Packham examines bizarre natural phenomena from around the globe, from strange creatures to geographical oddities."
80053653,Scream,09/01/2019,2019,TV-14,3,"In this new TV series sequel to the classic horror franchise, a cyberbullying incident in Lakewood leads to a murder with chilling echoes of the past."
70177057,The Walking Dead,09/01/2019,2018,TV-MA,9,"In the wake of a zombie apocalypse, survivors hold on to the hope of humanity by banding together to wage a fight for their own survival."
80025172,Narcos,09/01/2017,2017,TV-MA,3,The true story of Colombia's infamously violent and powerful drug cartels fuels this gritty gangster drama series.
80059047,Robocar Poli,09/01/2017,2015,TV-Y,4,"When disaster strikes in Brooms Town, police car Robocar Poli, fire truck Robotruck Roy and their friends on the rescue team race to save the day."
80108561,Toast of London,09/01/2017,2015,TV-MA,3,"After a divorce and fatal career move, a classically trained British stage actor navigates single life with his odd roommate and takes on horrid jobs."
70198116,Forensic Files,09/01/2016,2011,TV-14,9,Detectives and crime lab technicians use the latest and most fascinating procedures to solve crimes in this documentary-style show.
70157231,The 4400,09/01/2013,2007,TV-14,4,"4400 people who vanished over the course of five decades suddenly reappear. None have aged, and slowly it's revealed that they have mysterious powers."
70293622,Sofia the First,10/08/2018,2017,TV-Y,4,"When her commoner mother marries the king, average-girl Sofia finds that being a real princess isn't all it's cracked up to be."
70143811,Gossip Girl,10/08/2013,2012,TV-14,6,A group of hyperprivileged Manhattan private-school kids seem to get away with everything. Except an anonymous blogger is watching their every move.
80109399,Kibaoh Klashers,10/06/2017,2017,TV-Y7,2,"Young beetle Dylan and his friends Hailey and Ollie team up to compete against tough opponents in the exciting, high-octane sport of Battle Blading."
80063705,Word Party,10/06/2017,2017,TV-Y,3,"Meet Bailey, Franny, Kip and Lulu. They're adorable baby animals, and they want you to join the party and help them learn!"
70281526,The Fosters,10/05/2017,2017,TV-14,5,"This offbeat drama charts the ups and downs of an interracial lesbian couple and their multiethnic brood of biological, adopted and foster children."
80214792,Creeped Out,10/04/2019,2019,TV-Y7,2,"A masked figure known as ""The Curious"" collects tales of dark magic, otherworldly encounters and twisted technology in this kids anthology series."
80002479,Peaky Blinders,10/04/2019,2019,TV-MA,5,"A notorious gang in 1919 Birmingham, England, is led by the fierce Tommy Shelby, a crime boss set on moving up in the world no matter the cost."
80146284,Rotten,10/04/2019,2019,TV-MA,2,This docuseries travels deep into the heart of the food supply chain to reveal unsavory truths and expose hidden forces that shape what we eat.
80124711,Super Monsters,10/04/2019,2019,TV-Y,3,Preschool kids whose parents are the world's most famous monsters try to master their special powers while preparing for kindergarten.
80992228,KENGAN ASHURA,10/31/2019,2019,TV-MA,2,"Ohma Tokita enters a hidden world where corporate disputes are settled in brutal gladiator bouts. Forget the money, he just wants to fight – and win."
80113037,Midnight Diner: Tokyo Stories,10/31/2019,2019,TV-14,2,Patrons of an otherwise mundane Japanese diner find simple yet profound connections with one another based on the shared love of a particular dish.
80113304,Goldie & Bear,10/31/2018,2017,TV-Y,2,"Best pals Goldie and Bear, from ""Goldilocks and the Three Bears,"" join other characters from beloved stories for adventures in the Fairy Tale Forest."
80991060,Flavorful Origins,10/30/2019,2019,TV-G,2,"Delve into the delectable world of Chaoshan cuisine, explore its unique ingredients and hear the stories of the people behind its creation."
80185145,Fate/EXTRA Last Encore,10/30/2018,2018,TV-MA,2,"Hakuno Kishinami finds himself in the midst of a Holy Grail war with no memories of how he got there. Through his confusion, he must fight to survive."
80011206,Zoo,10/03/2017,2017,TV-14,3,"When animal species all over the world begin attacking humans, controversial zoologist Jackson Oz tries to discover the cause of the sudden change."
81034099,Jeopardy!,10/28/2019,2019,TV-G,5,"Alex Trebek hosts one of TV's longest-running game shows, where a trio of players buzz in with their knowledge of history, arts, pop culture and more."
80095241,Castlevania,10/26/2018,2018,TV-MA,2,A vampire hunter fights to save a besieged city from an army of otherworldly beasts controlled by Dracula himself. Inspired by the classic video games.
70300800,BoJack Horseman,10/25/2019,2019,TV-MA,6,"Meet the most beloved sitcom horse of the '90s, 20 years later. He’s a curmudgeon with a heart of...not quite gold...but something like gold. Copper?"
81192130,"ChuChu TV Kids Songs, Learning Videos & Bedtime Stories",10/25/2019,2019,TV-Y,2,This educational series for tiny tots features a toe-tapping spin on nursery rhymes with upbeat tunes and a diverse set of easy-to-follow lessons.
80095435,Greenhouse Academy,10/25/2019,2019,TV-PG,3,"When teen siblings Hayley and Alex enter an elite boarding school, they find rivalry, romance and a mystery related to the recent loss of their mom."
80201680,The Kominsky Method,10/25/2019,2019,TV-MA,2,Acting coach Sandy Kominsky and best friend Norman Newlander keep each other laughing as they navigate the ups and downs of getting older.
80158516,Great News,10/25/2018,2018,TV-14,2,A TV news producer's ambitions take an awkward turn when her mother rejoins the workforce and snags a job as the station's newest intern.
80068326,W1A,10/24/2017,2017,TV-MA,3,"The new Head of Values at the BBC deals with redefining the company's purpose, events like the arrival of Prince Charles and issues with new programs."
80142390,The Hollywood Masters,10/23/2018,2017,TV-PG,3,"Top Hollywood stars and directors open up about their dreams, struggles and lifelong obsessions in interviews filmed in front of a live audience."
70242310,Hemlock Grove,10/23/2015,2015,TV-MA,3,"Secrets are just a part of daily life in the small Pennsylvania town of Hemlock Grove, where the darkest evils hide in plain sight."
80072207,Bunk'd,10/21/2018,2018,TV-G,3,"The Ross siblings of Disney's hit series ""Jessie"" spend a summer full of fun and adventure at Maine's Camp Kikiwaka, where their parents first met."
80095900,Haters Back Off,10/20/2017,2017,TV-PG,2,"Determined to make it big, the confident but clueless Miranda Sings embarks on an unlikely quest for fame in this offbeat comedy."
70213238,Monty Python's Flying Circus,10/02/2018,1974,NR,4,"The Monty Python players make their mark with a winning mix of wit, ingenuity and brilliant timing – and a penchant for mockery and cross-dressing."
80000770,Making a Murderer,10/19/2018,2018,TV-14,2,"Filmed over 10 years, this real-life thriller follows a DNA exoneree who, while exposing police corruption, becomes a suspect in a grisly new crime."
80018294,Marvel's Daredevil,10/19/2018,2018,TV-MA,3,"Blinded as a young boy, Matt Murdock fights injustice by day as a lawyer and by night as the Super Hero Daredevil in Hell's Kitchen, New York City."
80994754,Project S The Series,10/19/2018,2017,TV-14,4,"Sports and friendship intertwine in tales of a volleyball team, an autistic badminton player, a skateboarder with depression and an archery-club crush."
80211634,Baby,10/18/2019,2019,TV-MA,2,"Fed up with their families and classmates, two teen girls from a wealthy part of Rome are drawn to the city's underworld and start leading double lives."
80176872,Little Baby Bum: Nursery Rhyme Friends,10/18/2019,2019,TV-Y,2,"Twinkle, Mia, Jacus and the rest of the Nursery Rhyme Friends perform catchy tunes for the little ones."
80126646,MeatEater,10/18/2019,2019,TV-14,4,Steven Rinella scrounges in some of America's wildest terrains in this unscripted series showing him on the hunt for wild animals from ducks to deer.
81094271,Spirit Riding Free: Pony Tales,10/18/2019,2019,TV-Y,2,"Find the fun and adventure of ""Spirit Riding Free"" in this mix of music videos and short episodes featuring Lucky and all of her friends!"
80160935,The House of Flowers,10/18/2019,2019,TV-MA,2,"In this dark comedy, a wealthy matriarch tries to maintain her family's facade of perfection after her husband's mistress exposes their dirty secrets."
81064730,Toon,10/18/2019,2017,TV-MA,2,"Reclusive, socially awkward jingle composer Toon must navigate the nightmarish world of show biz after a viral video skyrockets him to fame."
80227516,Chosen,10/17/2019,2019,TV-MA,2,"When a mysterious box arrives at his door, a doctor and father is forced to participate in a twisted killing game, or risk losing everything."
70235760,My Babysitter's a Vampire,10/17/2018,2012,TV-PG,2,"Ethan, Benny and fledgling vampire Sarah battle zombies, demons and the other supernatural beasties that regularly threaten their school."
70301553,Rake,10/16/2018,2018,NR,5,"While Cleaver Greene is a brilliant and driven attorney, he's also an ex-druggie, a current gambling addict and loathed by many of his colleagues."
80042307,Some Assembly Required,10/16/2015,2015,TV-G,2,A 14-year-old takes ownership of a toy company and hires a group of his friends to help him create amazing new toys.
80020935,Octonauts,10/15/2018,2015,TV-Y,4,A team of brave underwater explorers known as the Octonauts combs the world's oceans for aquatic creatures in desperate need of assistance.
80176076,Power Rangers Ninja Steel,10/15/2018,2018,TV-Y7-FV,2,A new generation of teen heroes uses superhuman ninja powers to battle the intergalactic villain Galvanax and save Earth from destruction.
80050063,The Seven Deadly Sins,10/15/2018,2018,TV-14,3,"When a kingdom is taken over by tyrants, the deposed princess begins a quest to find a disbanded group of evil knights to help take back her realm."
80135640,West Coast Customs,10/15/2017,2015,TV-G,6,"West Coast Customs, a mecca for well-heeled car lovers, stars as their team creates some of the most luxurious, outrageous vehicles on the planet."
70309457,Vampire Knight,10/15/2016,2008,TV-14,2,"At Cross Academy, two student disciplinary committee members are tasked with keeping the peace between a human class and a night class of vampires."
80057506,Edgar Rice Burroughs' Tarzan and Jane,10/12/2018,2018,TV-Y7-FV,2,"Saved from a plane crash and given supernatural powers, teen Tarzan joins forces with brave city girl Jane to protect his jungle home from threats."
80178943,The Boss Baby: Back in Business,10/12/2018,2018,TV-Y7,2,The Boss Baby brings his big brother Tim to the office to teach him the art of business in this animated series sprung from the hit film.
80195378,Haunted,10/11/2019,2019,TV-MA,2,"Real people sit down with friends and family to share terrifying true stories from their past, re-created through chilling re-enactments."
80179905,Insatiable,10/11/2019,2019,TV-MA,2,"A bullied teenager turns to beauty pageants as a way to exact her revenge, with the help of a disgraced coach who soon realizes he's in over his head."
80190086,The Hook Up Plan,10/11/2019,2019,TV-14,2,"When Parisian Elsa gets hung up on her ex, her best friends secretly hire a male escort to help her move on. But their plan works a little too well."
80212481,YooHoo to the Rescue,10/11/2019,2019,TV-Y,2,"In a series of magical missions, quick-witted YooHoo and his can-do crew travel the globe to help animals in need."
80036165,Schitt's Creek,10/10/2019,2019,TV-14,5,"Suddenly broke, the formerly filthy-rich Rose family is reduced to living in a ramshackle motel in a town they once bought as a joke: Schitt's Creek."
80083261,Burnistoun,10/01/2019,2012,TV-MA,2,"This sketch series focuses on the eccentric characters in a small Scottish town, including bumbling cops, ""DJ Jesus"" and a disgruntled serial killer."
80167821,Carmen Sandiego,10/01/2019,2019,TV-Y7-FV,2,"A master thief who uses her skills for good, Carmen Sandiego travels the world foiling V.I.L.E.'s evil plans – with help from her savvy sidekicks."
80083330,Limmy's Show!,10/01/2019,2012,TV-MA,2,"Scottish comic Brian ""Limmy"" Limond headlines this sketch series featuring him in various roles from a TV psychic to costumed adventurer ""Falconhoof."""
80116762,Killer Women with Piers Morgan,10/01/2018,2017,TV-MA,2,"Journalist Piers Morgan goes behind prison walls to speak with women convicted of shocking crimes, shedding light on what drove them to murder."
80073432,Still Game,10/01/2018,2016,TV-14,7,"Scottish pensioners Jack and Victor make the most of their golden years, getting themselves into all kinds of scrapes in their Glasgow suburb."
70155629,Charmed,10/01/2017,2005,TV-PG,8,"After a trio of sisters discover an ancient text in their mansion attic, revealing they possess latent supernatural powers, mischief and drama ensue."
80107077,Cleverman,10/01/2017,2017,TV-MA,2,"In the near future, physically powerful beings known as ""Hairies"" struggle to survive in a segregated society dominated by hostile humans."
70155618,Gilmore Girls,10/01/2017,2006,TV-14,7,"Fiercely independent single mom Lorelai raises gifted, Ivy League-bound daughter Rory amid a continual stream of quick-witted repartee."
80171004,Noddy Toyland Detective,10/01/2017,2016,TV-Y,2,"Toyland’s boy detective, Noddy, solves mysteries and finds missing objects with help from his friends: a panda, a superhero, a dinosaur and a robot."
70136140,Star Trek,10/01/2017,1968,TV-PG,3,"Led by unflappable Capt. Kirk, the crew of the starship Enterprise delves deep into the far reaches of space to explore new worlds and civilizations."
70158332,Star Trek: Enterprise,10/01/2017,2004,TV-PG,4,"Capt. Archer and his crew explore space and discover human innovation-expanding technologies as they meet new alien races in this ""Star Trek"" prequel."
70158331,Star Trek: Voyager,10/01/2017,2000,TV-PG,7,"On Voyager's 75-year journey back to Earth, the crew members encounter unknown species as they draw closer to a mysterious quadrant of space."
80109536,Skin Wars,10/01/2016,2016,TV-14,3,"Artists test their creativity and body painting skills as they face off in a series of elaborate challenges, vying for a grand prize of $100,000."
81011159,Little Things,11/09/2019,2019,TV-MA,3,"A cohabiting couple in their 20s navigate the ups and downs of work, modern-day relationships and finding themselves in contemporary Mumbai."
80147923,Treehouse Detectives,11/09/2018,2018,TV-Y,2,"When their animal friends need help, brother-and-sister team Toby and Teri use the clues and follow the facts to solve mysteries in their own backyard."
80045820,Danger Mouse,11/09/2016,2016,TV-Y7,2,The world's greatest super-spy returns to save the world with the help of hapless hamster Penfold and a collection of state-of-the-art gadgetry.
80209553,Busted!,11/08/2019,2019,TV-14,2,"Tackling different mysteries in each episode of this game show, seven sleuths get closer to solving the biggest one of all: What happened to Project D?"
81013505,The Great British Baking Show: Holidays,11/08/2019,2019,TV-PG,2,"Deck the halls with sugar, butter and chocolate as competitors from past seasons bake sweet Yuletide treats for judges Paul Hollywood and Prue Leith."
80230435,Wild District,11/08/2019,2019,TV-MA,2,"After surrendering to Bogotá police, an ex-guerrilla avoids prison by working undercover to investigate a ruthless enforcer of government corruption."
80180849,Fate/Apocrypha,11/07/2017,2017,TV-MA,2,The theft of the Greater Grail from Fuyuki City leads to a splintered timeline in which the Great Holy Grail War is waged on an unprecedented scale.
80058852,Project Mc²,11/07/2017,2017,TV-Y7,6,Teenage spy McKeyla teams up with three other super-smart girls to become secret agents who use their science and tech skills to save the day.
