title_id,title,date_added,release_year,rating,duration,description
70234439,Transformers Prime,09/08/2018,2013,TV-Y7-FV,1,"With the help of three human allies, the Autobots once again protect Earth from the onslaught of the Decepticons and their leader, Megatron."
80058654,Transformers: Robots in Disguise,09/08/2018,2016,TV-Y7,1,"When a prison ship crash unleashes hundreds of Decepticons on Earth, Bumblebee leads a new Autobot force to protect humankind."
80163890,Apaches,09/08/2017,2016,TV-MA,1,A young journalist is forced into a life of crime to save his father and family in this series based on the novel by Miguel Sáez Carral.
80117902,Fire Chasers,09/08/2017,2017,TV-MA,1,"As California's 2016 fire season rages, brave backcountry firefighters race to put out the flames, protect homes and save lives in this docuseries."
80244601,Castle of Stars,09/07/2018,2015,TV-14,1,"As four couples with different lifestyles go through the ebbs and flows of joy and sorrow, each must learn how to live a good life."
80190843,First and Last,09/07/2018,2018,TV-MA,1,Take an intimate look at the emotionally charged first and last days of new and soon-to-be released inmates at Georgia's Gwinnett County Jail.
80221550,Archibald's Next Big Thing,09/06/2019,2019,TV-Y7,1,"Happy-go-lucky chicken Archibald may not remember to do his chores, but he never forgets to have fun. After all, life's an adventure!"
80178151,The Spy,09/06/2019,2019,TV-MA,1,"In the 1960s, Israeli clerk-turned-secret agent Eli Cohen goes deep undercover inside Syria on a perilous, years-long mission to spy for Mossad."
80113482,No Tomorrow,09/05/2017,2016,TV-14,1,"Her straitjacketed life turned topsy-turvy by hunky Xavier, Evie discovers a new freedom – even though her man just might be an end-of-days crackpot."
80113641,Frequency,09/04/2017,2016,TV-14,1,"A detective seizes a precious opportunity to change the past when she finds she can communicate with her deceased, estranged father via a time warp."
80996949,Adam Ruins Everything,09/30/2018,2018,TV-14,1,"Education can be fun – and funny. Comedian Adam Conover bursts misconceptions, deconstructs topics and leaves with positive takeaways."
80239337,Ben 10,09/30/2018,2016,TV-Y7,1,Ben can transform into ten types of aliens. He'll try 'em all while adventuring across the country with his cousin Gwen and Grandpa Max.
81011682,Christiane Amanpour: Sex & Love Around the World,09/30/2018,2018,TV-MA,1,"A contextual, acculturated dive into how adults in six, big global cities celebrate love and accentuate sex. CNN's Christiane Amanpour reports."
80128317,The Eighties,09/30/2018,2016,TV-PG,1,"This nostalgic documentary series relives the 1980s from a variety of angles, exploring its impact on the politics, technology and culture of today."
81027384,The Nineties,09/30/2018,2017,TV-14,1,This U.S.-focused series dives into the cultural and political changes that swept the last decade of the 20th century. Executive produced by Tom Hanks.
80030186,The Seventies,09/30/2018,2015,TV-PG,1,"This series examines 1970s America, focusing on the major political and historical landmarks of the decade and the cultural response to those events."
80116921,We Bare Bears,09/30/2018,2017,TV-Y7,1,"Grizzly, Panda and Ice Bear are three adopted bear brothers struggling against their animal instincts to fit into the civilized, modern human world."
80181555,The Royal House of Windsor,09/30/2017,2017,TV-14,1,"Drawing on newly available info, this show traces how the British royal family has survived the last 100 years of power struggles, politics and more."
80184358,Lovesick,09/03/2018,2014,TV-14,1,Love and academics get complicated at an all-male college that happens to be located next to an all-female high school.
80163293,Mak Cun,09/29/2017,2015,TV-PG,1,A woman with an entrepreneurial spirit takes life into her own hands by starting a beauty cream business that inspires other women to take chances.
80199032,Paul Hollywood's Big Continental Road Trip,09/29/2017,2017,TV-14,1,"Gear up for a fast-paced journey as celebrity chef and avid auto enthusiast Paul Hollywood takes in the cars and culture of France, Italy and Germany."
80180449,Satu Hari,09/29/2017,2014,TV-14,1,"A man haunted by his wife's affair moves to Sarajevo and starts to love again, until fate forces him to choose between his new life and old loyalty."
80201933,Made in Mexico,09/28/2018,2018,TV-MA,1,"These Mexico City socialites may lead opulent lives, but a peek behind the curtain reveals a tangled web of intrigue, envy and personal struggles."
80225885,Bard of Blood,09/27/2019,2019,TV-MA,1,"Years after a disastrous job in Balochistan, a former Indian spy must confront his past when he returns to lead an unsanctioned hostage-rescue mission."
80218107,Dragons: Rescue Riders,09/27/2019,2019,TV-Y,1,"Twins Dak and Leyla and their dragon friends devote their lives to rescuing others, defending their home of Huttsgalor and having fun along the way."
80220715,Skylines,09/27/2019,2019,TV-MA,1,A hip-hop producer gets hurled into the violent world of organized crime when the record label he signs to becomes the center of a deadly drug business.
80241248,The Politician,09/27/2019,2019,TV-14,1,Rich kid Payton has always known he's going to be president. But first he has to navigate the most treacherous political landscape of all: high school.
81025403,The Inmate,09/26/2019,2018,TV-MA,1,A former Marine poses as an inmate inside a Mexican prison in order to infiltrate a gang suspected of kidnapping a U.S. judge's teen daughter.
80238106,Team Kaylie,09/23/2019,2019,TV-PG,1,"After a brush with the law, teen celebrity Kaylie Konrad swaps social stardom for court-ordered chaos as a middle school wilderness club leader."
81004814,BONDING,09/22/2019,2019,TV-MA,1,A New York City grad student moonlighting as a dominatrix enlists her gay BFF from high school to be her assistant.
81095101,Vagabond,09/21/2019,2019,TV-MA,1,"When his nephew dies in a plane crash, stunt man Cha Dal-geon resolves to find out what happened, with the help of covert operative Go Hae-ri."
80195173,Battlefish,09/21/2018,2018,TV-MA,1,"Over the course of a fishing season, tough men and women pursue lucrative albacore tuna in the competitive waters off the Oregon coast."
80241960,DRAGON PILOT: Hisone & Masotan,09/21/2018,2018,TV-14,1,Recently stationed Air Self-Defense Force rookie Hisone Amakasu is chosen by a dragon concealed within Gifu Air Base to be his pilot.
80115346,Hilda,09/21/2018,2018,TV-Y7,1,"Fearless, free-spirited Hilda finds new friends, adventure and magical creatures when she leaves her enchanted forest home and journeys to the city."
80124522,Maniac,09/21/2018,2018,TV-MA,1,Two struggling strangers connect during a mind-bending pharmaceutical trial involving a doctor with mother issues and an emotionally complex computer.
80157073,The Good Cop,09/21/2018,2018,TV-PG,1,"When he's not solving murders, a pathologically honest detective tries to keep an eye on his crooked but kindhearted dad."
81020513,Criminal: France,09/20/2019,2019,TV-MA,1,"Secrets emerge and entire cases unravel inside a police interview room in Paris, where suspects and investigators face off in an intricate dance."
81020518,Criminal: Germany,09/20/2019,2019,TV-MA,1,"In the interview room, detectives go head-to-head with suspects and try to get to the truth – even if it means breaking the rules and risking it all."
81020523,Criminal: Spain,09/20/2019,2019,TV-MA,1,"Psychological games abound between detectives and suspects in a tense interrogation room, where the search for answers sometimes comes at a moral cost."
80216172,Criminal: UK,09/20/2019,2019,TV-MA,1,"Within the walls of an interrogation room and with time running out, London investigators go after three suspects, each accused of a grievous crime."
80184771,Inside Bill's Brain: Decoding Bill Gates,09/20/2019,2019,TV-14,1,Take a trip inside the mind of Bill Gates as the billionaire opens up about those who influenced him and the audacious goals he's still pursuing.
81000389,The Hockey Girls,09/20/2019,2019,TV-MA,1,"The passionate members of a girls' roller hockey team chase down victories in the rink while striving to make time for school, family and romance."
80244627,Two Sentence Horror Stories,09/20/2019,2019,TV-14,1,This anthology series of terror features diverse characters facing primal fears in spine-chilling situations that stretch past daily routine.
80189183,Mobile Suit Gundam UC,09/20/2018,2014,TV-14,1,"When Banagher Links meets the mysterious Audrey Burne, he inherits the Unicorn Gundam and is swept up into the battle for space colony independence."
80224294,Monkey Twins,09/02/2018,2018,TV-MA,1,"Inspired by Khon dance drama and Thai martial arts, a fighter scarred by the past joins forces with a determined cop to battle an organized crime ring."
80128096,Chef's Table: France,09/02/2016,2016,TV-14,1,Sample the bold new flavors of France with chefs who are pushing the boundaries of fine dining and reinventing a rich culinary tradition.
80057610,Kulipari: An Army of Frogs,09/02/2016,2016,TV-Y7-FV,1,"In a tale of bravery and heroism, fearless frogs go to war against the sinister scorpions and spiders that have teamed up to conquer the amphibians."
70259208,Transformers: Rescue Bots,09/19/2018,2016,TV-Y7,1,"Follow the adventure of four young transformers, Heatwave, Chase, Blades and Boulder, and their human counterparts: a family of emergency responders."
80176878,Manhunt,09/19/2017,2017,TV-14,1,"Faced with few clues and an increasingly panicked public, the FBI calls on a new kind of profiler to help track down the infamous Unabomber."
81144925,When the Camellia Blooms,09/18/2019,2019,TV-14,1,"Dongbaek is a single mother. When a potential new love enters her life, she finds ways to defy the social stigmas surrounding her."
80136785,Forget Me Not,09/18/2017,2011,TV-MA,1,"Teenage Xue Ming was forced to marry the man who raped her. Years after abandoning her young sons to find a better life, can she escape the guilt?"
80135278,The Beat,09/18/2017,2012,TV-PG,1,"The artistic pursuits of two childhood friends, an aspiring singer and a talented dancer, lead them to four other 20-somethings in a drumming group."
80136452,Timeless Season,09/18/2017,2009,TV-14,1,"A decade after college, a wake reunites five female friends struggling with illness, infidelity, toxic in-laws, spousal abuse and other life issues."
70178604,Ancient Aliens,09/17/2019,2010,TV-PG,1,"Were ancient humans really behind some of the most important technological advances in civilized history, or did they have extraterrestrial help?"
80219119,The Last Kids on Earth,09/17/2019,2019,TV-Y7-FV,1,"When zombies and monsters invade his hometown, a scrappy 13-year-old orphan teams up with his friends in hopes of surviving the chaos."
80165072,Click for Murder,09/17/2017,2017,TV-14,1,Crime journalist Donal MacIntyre reveals how deadly the internet can be as he dissects the technological methods behind heinous acts.
70251519,America's Book of Secrets,09/15/2019,2014,TV-14,1,"This engaging documentary series shares the surprising backstories of familiar institutions like the Pentagon, West Point and the Playboy Mansion."
81174992,Bakugan: Battle Planet,09/15/2019,2018,TV-PG,1,Dan Kouzo and his pals bond with mysterious creatures known as Bakugan while fighting sinister forces out to control the world.
81044365,Cold Case Files,09/15/2019,2017,TV-14,1,Masterful detectives utilize forensic science and criminal psychology to re-examine long-standing cases.
70143865,Pawn Stars,09/15/2019,2010,TV-PG,1,"Father Richard Harrison, son Rick and grandson Corey appraise an array of strange objects brought into their Gold & Silver Pawn Shop in Las Vegas."
81069393,Surviving R. Kelly,09/15/2019,2019,TV-MA,1,"In this documentary series on the tangled history of allegations against musician R. Kelly, women give detailed accounts of sexual and mental abuse."
80012550,The Curse of Oak Island,09/15/2019,2014,TV-PG,1,"On an ominous island off of Nova Scotia, two brothers chase historical theories on a quest for enigmatic treasure."
81176196,The Rap Game,09/15/2019,2016,TV-14,1,Young lyricists between the ages of 12 and 16 compete for a chance to sign to Jermaine Dupri's label while being mentored by hip-hop and R&B's finest.
70143831,The Universe,09/15/2019,2009,TV-PG,1,"Discover the secrets of the universe in this series that pairs animation with insights on distant planets, black holes and other celestial marvels."
81003648,Al Hayba,09/15/2018,2017,TV-14,1,"In a village by the Lebanon-Syria border, the head of an arms-smuggling clan contends with family conflicts, power struggles and complicated love."
80241102,Cabins in the Wild with Dick Strawbridge,09/15/2018,2017,TV-PG,1,"Engineer Dick Strawbridge and craftsman Will Hardie tour eight unique cabins built for a pop-up hotel in Wales, and construct No. 9 on their own."
80241103,How to Live Mortgage Free with Sarah Beeny,09/15/2018,2018,TV-14,1,Real estate expert and TV presenter Sarah Beeny meets with clever property owners who share their colorful stories about living mortgage free.
80240816,Inside The Freemasons,09/15/2018,2017,TV-14,1,"Explore the history and future of the Freemasons, a fraternal order steeped in both secrecy and tradition."
80202129,The Five,09/15/2017,2016,TV-MA,1,"Twenty years after 5-year-old Jesse disappears near his home, his DNA turns up at the scene of a woman's murder, baffling his family and the police."
80126566,Wartime Portraits,09/15/2016,2014,TV-MA,1,"Part live-action and part animation, this visually inventive series offers striking portrayals of some of the unsung heroes of World War II."
80243899,Behind the Newsroom,09/14/2018,2015,TV-14,1,"Confident and cool under pressure, top news presenter Punchalee meets her match in the conniving Dao, who'll stop at nothing to fulfill her ambitions."
80220035,Boca Juniors Confidential,09/14/2018,2018,TV-PG,1,"Players, fans and staff of soccer powerhouse Boca Juniors provide an exclusive, behind-the-scenes look at Argentina's legendary club."
80194704,Car Masters: Rust to Riches,09/14/2018,2018,TV-PG,1,"The colorful crew at Gotham Garage overhauls an eclectic collection of cars and trucks, trading up to a showstopper they can sell for big bucks."
80225949,Norm Macdonald Has a Show,09/14/2018,2018,TV-MA,1,Comedian Norm Macdonald hosts his celebrity friends for casual conversations that range from silly to serious and take many unexpected turns.
81002336,Super Monsters Monster Party,09/14/2018,2018,TV-Y,1,"Sing along and move to this groovy collection of music videos featuring monster friends Katya, Lobo, Zoe, Drac, Cleo and Frankie!"
80993613,The Rise of Phoenixes,09/14/2018,2018,TV-14,1,"When a secret from the past rears its head, a respected court scholar must choose between avenging her family and staying true to the prince she loves."
81095103,Kabaneri of the Iron Fortress: The Battle of Unato,09/13/2019,2019,TV-MA,1,"Ikoma and the Iron Fortress take their fight to the battlegrounds of Unato, joining the alliance to reclaim the region from the kabane horde."
80217779,Marianne,09/13/2019,2019,TV-MA,1,"Lured back to her hometown, a famous horror writer discovers that the evil spirit who plagues her dreams is now wreaking havoc in the real world."
80211572,Monarca,09/13/2019,2019,TV-MA,1,"After 20 years, Ana María returns to Mexico and vies for control of her family's tequila empire as it threatens to crumble under corruption and secrets."
80217669,Top Boy,09/13/2019,2019,TV-MA,1,"Two seasoned drug dealers return to the gritty streets of London, but their pursuit of money and power is threatened by a young and ruthless hustler."
80153467,Unbelievable,09/13/2019,2019,TV-MA,1,"After a young woman is accused of lying about a rape, two female detectives investigate a spate of eerily similar attacks. Inspired by true events."
80993062,The I-Land,09/12/2019,2019,TV-MA,1,"Wiped clean of memories and thrown together, a group of strangers fight to survive harsh realities – and the island that traps them."
81098586,"The Mind, Explained",09/12/2019,2019,TV-14,1,"Ever wonder what's happening inside your head? From dreaming to anxiety disorders, discover how your brain works with this illuminating series."
81011508,Life,09/12/2018,2018,TV-MA,1,"At Korea's top university medical center, ideals and interests collide between a patient-centered ER doctor and the hospital's newly-appointed CEO."
80223685,Daniel Sloss: Live Shows,09/11/2018,2018,TV-MA,1,"Comedian Daniel Sloss is ready to find the funny in some very dark topics, from the deeply personal to the truly irreverent."
80189586,If I were an Animal,09/11/2018,2018,TV-Y,1,"Curious kids Emma and her big brother Tim observe different animals as they make their way through various life milestones, from birth to adulthood."
81077065,Terrace House: Tokyo 2019-2020,09/10/2019,2019,TV-MA,1,"Six strangers share a fabulous house in Tokyo, looking for love while living under the same roof. With no script, what happens next is all up to them."
81073764,Loo Loo Kids: Johny & Friends Musical Adventures,09/01/2019,2016,TV-Y,1,"Music-loving baby Johny goes on dance-filled adventures with his family, friends and adorable critters in this colorful, animated preschooler series."
80241003,Serial Killer with Piers Morgan,09/01/2019,2018,TV-14,1,"Through intense prison interviews, Piers Morgan revisits the crimes of three convicted serial killers and learns more about their motives."
81154900,Transformers Rescue Bots Academy,09/01/2019,2019,TV-Y,1,"As part of the first class at the Rescue Bots Academy, five Cybertron recruits train under their skilled teachers and take on daring rescue missions."
81154956,Transformers: Cyberverse,09/01/2019,2018,TV-Y7,1,Optimus Prime and the AllSpark are missing – and only a memory-scrambled Bumblebee holds the key to finding them in this animated sci-fi series.
81004113,Age of Rebellion,09/01/2018,2018,TV-MA,1,"At their high school, a group of unruly teens wreak havoc, face bullies and navigate turbulent lives beyond school grounds."
80994108,Sisters,09/01/2018,2018,TV-MA,1,Her dad's deathbed confession leads Julia to discover she has more than 100 brothers and two sisters: troubled TV star Roxy and uptight lawyer Edie.
81004162,The Road to Calvary,09/01/2018,2017,TV-14,1,"Swept up in political unrest during World War I, two sisters in St. Petersburg cope with turbulent romances as Russian history is made around them."
80188969,A Boy Name Flora A,09/01/2017,2017,TV-MA,1,A 28-year-old layabout begins to re-examine his life when his dysfunctional family assembles to pay respects to a dying grandmother who won’t pass on.
80189155,A House of Blocks,09/01/2017,2017,TV-MA,1,"Yijuan and her mentally ill sister Kaiqi struggle to be happy in the face of misfortune, criminal intrigue, marital strife, an exorcism and a ghost."
80189208,All About Love,09/01/2017,2017,TV-14,1,Mysterious ghosts – determined to reconnect with the living world – begin to cross over and disrupt the lives of those they left behind.
80178543,FINAL FANTASY XIV Dad of Light,09/01/2017,2017,TV-PG,1,A father and son rekindle their bond through the online role-playing game Final Fantasy XIV in this live-action series based on a true story.
70213196,Gurren Lagann,09/01/2017,2007,TV-14,1,"When a young laborer escapes to the world aboveground, he discovers a violent land in which humans battle robots controlled by a power-hungry noble."
70208520,High Risk,09/01/2017,1988,TV-G,1,"From scientists to snake handlers, this series explores what motivates some people to put themselves in jeopardy to perform extraordinary feats."
80105933,LEGO Elves: Secrets of Elvendale,09/01/2017,2017,TV-Y7,1,"Armed with a powerful amulet, a teenage guardian is tasked with protecting her little sister – and all of Elvendale. Based on the popular web series."
80133200,Maniac,09/01/2017,2015,TV-MA,1,"A nondescript man in a mental hospital has an exciting life of adventure and romance – in his head. He may be insane, or maybe he's just having fun."
80200913,Tip the Mouse,09/01/2017,2014,TV-Y,1,"In his tiny meadow village, curious little mouse Tip enjoys fun and adventure while learning about the world with his furry friends and family."
80118873,Conspiracy,09/01/2016,2015,TV-14,1,"Skeptics and others discuss widely held conspiracy theories involving aliens, government cover-ups, secret assassinations and other intrigues."
70229514,Dead Set,09/01/2016,2008,TV-MA,1,"While the housemates in the Big Brother house remain oblivious, fast-moving hordes of the undead decimate the studio compound."
70303288,Easy Fortune Happy Life,09/01/2016,2009,TV-14,1,"Years after a wealthy man is healed by a rural herbalist, fate lands him in the same hospital where the woman's granddaughter is treating patients."
80111273,Game Winning Hit,09/01/2016,2009,TV-PG,1,An army deserter hiding out in a small coastal town becomes the coach of a youth baseball team and develops warm relationships in his new community.
80111710,Lucky Days,09/01/2016,2010,TV-14,1,"When laidback Ren, who is about to divorce his money-crazy wife, finds a time-traveling computer, he decides to use it to reboot his marriage."
80128337,Station Horizon,09/01/2016,2015,TV-MA,1,"Ex-con Joris returns to his Swiss hometown, a community obsessed with American culture and ideals, to start over and save his family's gas station."
70303289,The Fierce Wife,09/01/2016,2010,TV-14,1,Beautiful housewife Xie An Zhen seems to be living the perfect life but finds her world crumbling after learning that her husband is cheating on her.
80111614,The Womanizer,09/01/2016,2010,TV-PG,1,Libertine He-jie finds himself torn between the lovely Amanda and fiery Xiao-qian. But now he faces a new problem: arrogant rival suitor Cheng-en.
80111275,The Year of Happiness and Love,09/01/2016,2009,TV-14,1,"Jiang Chen-bo is a loser without prospects for success, until a surprise promotion becomes the catalyst for his entire family's upturn in fortune."
80118889,Witches: A Century of Murder,09/01/2016,2015,TV-14,1,"Historian Suzannah Lipscomb investigates the witch hunts that plagued Britain in the 17th century, examining common myths about their origin."
80216665,Rhythm + Flow,10/09/2019,2019,TV-MA,1,"In this music competition show, judges Tip “T.I.” Harris, Cardi B and Chance the Rapper hit the streets to find the next rap superstar."
80113144,StoryBots Super Songs,10/07/2016,2016,TV-Y,1,"Characters from the popular StoryBots apps for early childhood education give musical lessons on math, science, history, behaviors, emotions and more."
80174918,ID-0,10/06/2017,2017,TV-14,1,"In the midst of a field exercise operating I-Machines, Alliance Academy student Maya Mikuri is thrown into an entirely different kind of adventure."
80215730,Legend Quest: Masters of Myth,10/05/2019,2019,TV-Y7,1,"When mythical creatures come to life, it's up to Leo, Teodora, Don Andrés and Alebrije – super-secret monster hunters – to save the day."
81161487,My Country: The New Age,10/05/2019,2019,TV-14,1,"At the end of the Goryeo period, there were those who led the charge to proclaim a new age – and the ordinary individuals who risked everything."
80198511,Dancing Queen,10/05/2018,2018,TV-14,1,Snatching trophies. Getting gorgeous. Turning it up. Alyssa Edwards rules the dance studio by day – and the drag world by night.
80240840,Empire Games,10/05/2018,2018,TV-14,1,Interviews with scholars and dramatic reenactments bring to life the origins and history-making achievements of the world's greatest ancient empires.
80191369,LOST SONG,10/05/2018,2018,TV-14,1,"War looms over the kingdom of Neunatia, where two young women are both burdened and blessed by the power of song."
80220650,YG Future Strategy Office,10/05/2018,2018,TV-MA,1,"K-pop star Seungri, BIGBANG's youngest member, tries to lead a team of bumbling staff at YG's Future Strategy Office in this mockumentary sitcom."
80117803,Raising Dion,10/04/2019,2019,TV-PG,1,A widowed mom sets out to solve the mystery surrounding her young son's emerging superpowers while keeping his extraordinary gifts under wraps.
81010662,Violet Evergarden: Special,10/04/2018,2018,TV-PG,1,"Auto Memory Doll Violet Evergarden writes letters for people who can’t, learning about her war-torn country and her own hardened heart along the way."
80203920,Nowhere Man,10/31/2019,2019,TV-MA,1,"Two nefarious schemes taking place 10 years apart entangle a dauntless triad member, who must break out of prison to rescue a loved one."
80242051,Sleepless Society: Bedtime Wishes,10/31/2019,2019,TV-MA,1,"During a holiday stay at a hotel resort, a flight attendant encounters a wealthy, mysterious man with two different personas."
80204927,Zumbo's Just Desserts,10/31/2017,2016,TV-14,1,"Dessert wizard Adriano Zumbo looks for the next “Willy Wonka” in this tense competition that finds skilled amateurs competing for a $100,000 prize."
81166978,"Bring It On, Ghost",10/30/2019,2016,TV-14,1,A college student with psychic abilities takes in an amnesiac ghost as his roommate – who ends up helping him hunt down spooky spirits.
81167029,Tomorrow with You,10/30/2019,2017,TV-14,1,The head of a real estate firm with the ability to travel through time by taking the subway marries a photographer to try and change his future.
81142594,Tunnel,10/30/2019,2019,TV-MA,1,A detective finds himself 30 years in the future and must solve a string of grisly crimes before he can return to the past.
80987753,The Degenerates,10/30/2018,2018,TV-MA,1,Six stand-ups explore the coarse and salacious side of comedy in this series of half-hour specials. For mature audiences.
80217066,Seis Manos,10/03/2019,2019,TV-MA,1,"Orphans raised by a martial arts master are plunged into a mystery involving demonic powers, drug cartels, ancient rituals and blood sacrifice."
